{
  "$schema": "https://json-schema.org/draft/2020-12/schema",
  "$id": "https://agentic-coding-tools.dev/schemas/review-findings.schema.json",
  "title": "Review Findings",
  "type": "object",
  "required": [
    "review_type",
    "target",
    "findings"
  ],
  "properties": {
    "review_type": {
      "type": "string",
      "enum": [
        "plan",
        "implementation"
      ]
    },
    "target": {
      "type": "string",
      "description": "feature_id for plan review, package_id for implementation review."
    },
    "reviewer_vendor": {
      "type": "string"
    },
    "coverage": {
      "type": "object",
      "description": "Optional per-vendor coverage report added by add-deterministic-review-preprocessing. Absent means 'unreported' — the dispatcher treats an absent block as full coverage, never as a penalty.",
      "properties": {
        "reviewed": {
          "type": "array",
          "items": { "type": "string" },
          "description": "Paths this vendor actually reviewed."
        },
        "skipped": {
          "type": "array",
          "items": {
            "type": "object",
            "required": ["path", "reason"],
            "properties": {
              "path": { "type": "string" },
              "reason": { "type": "string" }
            }
          },
          "description": "Paths this vendor was asked to review but did not, with why."
        },
        "rate": {
          "type": "number",
          "minimum": 0,
          "maximum": 1,
          "description": "reviewed / (reviewed + skipped), computed by the dispatcher if the vendor did not supply it."
        }
      }
    },
    "findings": {
      "type": "array",
      "items": {
        "type": "object",
        "required": [
          "id",
          "type",
          "criticality",
          "description",
          "disposition",
          "axis",
          "severity"
        ],
        "properties": {
          "id": {
            "type": "integer"
          },
          "type": {
            "type": "string",
            "enum": [
              "spec_gap",
              "contract_mismatch",
              "architecture",
              "security",
              "performance",
              "style",
              "correctness",
              "observability",
              "compatibility",
              "resilience",
              "behavioral_failure"
            ]
          },
          "criticality": {
            "type": "string",
            "enum": [
              "low",
              "medium",
              "high",
              "critical"
            ]
          },
          "description": {
            "type": "string"
          },
          "resolution": {
            "type": "string"
          },
          "disposition": {
            "type": "string",
            "enum": [
              "fix",
              "regenerate",
              "accept",
              "escalate"
            ]
          },
          "package_id": {
            "type": "string"
          },
          "file_path": {
            "type": "string",
            "description": "File path the finding relates to (optional, enables cross-vendor matching)"
          },
          "line_range": {
            "oneOf": [
              {
                "type": "object",
                "properties": {
                  "start": {
                    "type": "integer"
                  },
                  "end": {
                    "type": "integer"
                  }
                }
              },
              {
                "type": "string",
                "pattern": "^\\s*\\d+(\\s*-\\s*\\d+)?\\s*$"
              }
            ],
            "description": "Line range within file_path (optional). Two shapes are accepted, matching consensus_synthesizer._parse_line_range: the canonical object form, and the bare string form ('10' or '10-20') that vendors emit in practice. The parser was widened to accept the string; this schema was not, so the CLI replay path rejected documents the in-process path consumed fine. Keep the two in step."
          },
          "axis": {
            "type": "string",
            "enum": [
              "correctness",
              "readability",
              "architecture",
              "security",
              "performance",
              "observability",
              "resilience",
              "compatibility"
            ],
            "description": "8-axis review categorization (5 code-review axes plus the fitness-function axes observability, resilience, compatibility)"
          },
          "severity": {
            "type": "string",
            "enum": [
              "critical",
              "nit",
              "optional",
              "fyi",
              "none"
            ],
            "description": "5-severity prefix (from code-review-and-quality skill)"
          },
          "evidence_class": {
            "type": "string",
            "enum": [
              "deterministic",
              "judgment"
            ],
            "default": "deterministic",
            "description": "How this finding was established. 'deterministic' means a reproducible observation \u2014 a test failed, a schema mismatched, a scanner rule fired; re-running the same input yields the same finding, and a seeded defect can prove the detector works. 'judgment' means a model reasoned about the artifact; the finding may be correct and valuable but is not reproducible and cannot be falsified by seeding a defect. Only deterministic findings are counted as blocking by the consensus synthesizer. Optional and defaulting to 'deterministic' so existing emitters are unchanged; callers dispatching a judgment-class reviewer declare it at ingest rather than trusting the model to self-label."
          },
          "evidence_level": {
            "type": "string",
            "enum": [
              "direct",
              "supported",
              "inferred",
              "speculative",
              "unknown"
            ],
            "description": "Optional. How strongly what the reviewer actually saw backs this finding's claim, in the same tier vocabulary as explain-code's why mode: 'direct' restates one observed record, 'supported' is backed by two or more independent records, 'inferred' follows from observed records by reasoning, 'speculative' is plausible but not derived from what was observed, 'unknown' means there is no evidence either way. Informational only: unlike evidence_class, no consensus, coercion or blocking logic reads it."
          },
          "existing_code": {
            "type": "string",
            "description": "Optional verbatim excerpt of one or more consecutive lines from the reviewed diff that this finding targets, added by add-deterministic-review-preprocessing. Leading diff markers ('+'/'-') and surrounding whitespace are ignored by the ingest-time line resolver; a vendor-supplied line_range still wins when both are present."
          },
          "line_resolution": {
            "type": "string",
            "readOnly": true,
            "enum": [
              "vendor",
              "hunk_new",
              "hunk_old",
              "file",
              "unresolved"
            ],
            "description": "How line_range was determined, added by add-deterministic-review-preprocessing. 'vendor' means the vendor supplied a usable line_range directly; 'hunk_new'/'hunk_old'/'file' mean the ingest-time resolver matched existing_code on that side of the diff or in the full file; 'unresolved' means matching failed and line_range is absent (the finding is kept regardless). readOnly: this is stamped by the ingest-time resolver after the vendor responds, never a value the vendor is asked to supply — review prompt contracts derived from this schema (see review_findings_schema.prompt_contract) exclude it."
          }
        }
      }
    }
  }
}
