{
  "review_type": "plan",
  "target": "cli-dispatch",
  "reviewer_vendor": "grok",
  "findings": [
    {
      "id": 1,
      "type": "spec_gap",
      "criticality": "medium",
      "description": "Placeholder pending plan artifact review.",
      "disposition": "accept",
      "axis": "correctness",
      "severity": "none"
    }
  ]
}