{
  "review_type": "implementation",
  "target": "toolkit-consistency",
  "reviewer_vendor": "claude_code",
  "findings": [
    {
      "id": 1,
      "type": "correctness",
      "criticality": "medium",
      "description": "The VAL_FIX 8 baseline paragraph for ledger 79 does not reconcile with the sentence two lines above it. It states the pre-merge run counted 189 passed + 1 skipped and derives this as 67 (this change) + 123 (pre-existing) = 190 collected. The same E2E section says the pre-merge VALIDATE run of 2026-10-10 'had skipped' the 15 rsync-gated tests. Both cannot hold for one run: 15 rsync skips plus the node_modules skip would give 16 skipped, so either the pre-merge total was 174 passed + 16 skipped (and 123 is wrong), or the 15 rsync tests were not skipped in the run whose count is 189 + 1, or the two sentences describe different pre-merge runs. Ledger 79 asked precisely for the 189 -> 255 delta to be explained; the explanation as written is internally contradictory. Fix: name which pre-merge run each number comes from, and give the pass/skip split that includes the rsync skips.",
      "disposition": "fix",
      "axis": "correctness",
      "severity": "nit",
      "evidence_class": "judgment",
      "file_path": "openspec/changes/toolkit-consistency/validation-report.md",
      "existing_code": "in this checkout\"; rsync is installed here, so the 15 rsync-gated tests (which the pre-merge\nVALIDATE run of 2026-10-10 had skipped) all executed.",
      "line_resolution": "unresolved"
    },
    {
      "id": 2,
      "type": "correctness",
      "criticality": "low",
      "description": "The Security section still says 'One hit only' for a grep whose pattern list includes the literal `github_pat_` over `docs`, while the new Validation Review section admits that pattern hits twice in `docs/kanban-viz/README.md`. The reconciling gloss (the count is of token-shaped matches) lives only in the Validation Review section; a reader of the Security section, which is the section whose `**Status**` the goal gate parses, sees a claim that the Security section's own pattern list contradicts. Fix: amend the Security section itself to state one token-shaped hit plus two prose matches on `github_pat_` that are not tokens and are outside this change.",
      "disposition": "fix",
      "axis": "correctness",
      "severity": "nit",
      "evidence_class": "judgment",
      "file_path": "openspec/changes/toolkit-consistency/validation-report.md",
      "existing_code": "`github_pat_` also appears twice in prose in `docs/kanban-viz/README.md` (error-code names\n`github_pat_denied`, `github_pat_missing`, pre-existing and outside this change), which the\nSecurity section's \"one hit\" count, being a count of token-shaped matches, does not list.",
      "line_range": {
        "start": 194,
        "end": 196
      },
      "line_resolution": "hunk_new"
    },
    {
      "id": 3,
      "type": "spec_gap",
      "criticality": "low",
      "description": "Outcome 4 evidence relies on a loose grep that now matches 61 files where the pre-merge round matched 59 ('the pre-merge 59-file loose grep re-run (61 files, same classification)'). The two additional files are not named, so 'same classification' is asserted rather than shown; the payload hash being byte-identical to e4d0b25 does not help because the pre-merge grep ran on an earlier commit (bdfeefe) before other changes were merged into the roadmap branch. Name the two new matches and their category (documentation string, repo-root marker, opt-in integration) so the outcome-4 claim does not rest on an unexplained delta.",
      "disposition": "fix",
      "axis": "correctness",
      "severity": "optional",
      "evidence_class": "judgment",
      "file_path": "openspec/changes/toolkit-consistency/validation-report.md",
      "existing_code": "pre-merge 59-file loose grep re-run (61 files, same classification).",
      "line_range": {
        "start": 251,
        "end": 251
      },
      "line_resolution": "hunk_new"
    },
    {
      "id": 4,
      "type": "observability",
      "criticality": "low",
      "description": "The Validation Review section sets its own `**Status**: pass` in the same VAL_FIX 8 commit that answers the round's findings, and records no verification round over that fix; it also calls VAL_FIX 8 'this commit' without naming the SHA (the header names e4d0b25 and 44f6960 only). After this verification round completes, the section should record its outcome and the VAL_FIX 8 commit SHA so the pass status is traceable to a round that reviewed the fixed text rather than only to the round whose findings it fixed.",
      "disposition": "fix",
      "axis": "observability",
      "severity": "fyi",
      "evidence_class": "judgment",
      "file_path": "openspec/changes/toolkit-consistency/validation-report.md",
      "existing_code": "Findings (ledger id, criticality) and dispositions. Nothing blocked under D3, so the wired\napplicator never fired; VAL_FIX 8 is a conductor sub-step (this commit), report text only:",
      "line_range": {
        "start": 244,
        "end": 245
      },
      "line_resolution": "hunk_new"
    },
    {
      "id": 5,
      "type": "style",
      "criticality": "low",
      "description": "The explanation for why `goal_gate.py` and its test appear in the packet ('which the three-dot diff shows only because the roadmap tip already carries that commit') reads as a contradiction: if the roadmap tip carried the commit and this branch descended from it, the merge base would include it and the three-dot diff would not show it. The report elsewhere states `git diff origin/openspec/roadmap-multiplayer-collaboration 44f6960 -- skills docs` is empty, which is consistent only if the fix was cherry-picked onto this branch from a merge base that predates it (the addendum's two SHAs, 94bf202 / d1f65b25, confirm this). Reword to say the merge base predates the goal-gate fix and both branches carry it as separate commits.",
      "disposition": "fix",
      "axis": "readability",
      "severity": "optional",
      "evidence_class": "judgment",
      "file_path": "openspec/changes/toolkit-consistency/validation-report.md",
      "existing_code": "plus its test, which the three-dot diff shows only because the roadmap tip already carries\nthat commit; `loop-state.json`, `.review-ledger/**` and `.review-cache/**` excluded) plus a",
      "line_range": {
        "start": 175,
        "end": 176
      },
      "line_resolution": "hunk_new"
    },
    {
      "id": 6,
      "type": "spec_gap",
      "criticality": "low",
      "description": "Re-verification of open ledger 75: the outcome-1 row now states that trackedness is the consumer's act, that the installer writes the file and cannot commit it, and that proposal.md and docs/guides/skills.md make committing the stamp the declaration of the pin. This satisfies the first of the two remedies ledger 75 offered ('note in the report that trackedness is a human step the toolkit does not verify'). The item can be closed as addressed by report text; the alternative remedy (an `install.sh` warning on `git check-ignore`) remains a code change outside this phase.",
      "disposition": "accept",
      "axis": "correctness",
      "severity": "fyi",
      "evidence_class": "judgment",
      "file_path": "openspec/changes/toolkit-consistency/validation-report.md",
      "existing_code": "\"Tracked\" is the consumer's act: the installer writes the file and cannot commit it; the proposal and `docs/guides/skills.md` make committing it the declaration of the pin (ledger 75, open advisory) |",
      "line_resolution": "unresolved"
    }
  ]
}